Persony,Věk,Pohlaví,Váha (kg),Výška (cm),Úroveň aktivity,Zdravotní stav,Cíl,Užívání léků,Alergie,Styl výživy
Fitness,20,Male,80,180,Very Active,Bez obtíží,"Nárůst svalové hmoty, zachování nízkého procenta tuku",Neužívá,Žádné,"Jí vše, 5x denně fitness jídlo"
Foodie,25,Female,60,175,Very Active,"Nízká hladina vitaminu D v krvi 
Občas ji bolí břicho a má poruchy trávení, ale neví z čeho, bezlepkovou dietu dodržuje","Chce být krásná a zdravá, udržovat zdravou hmotnost",Antikoncepce,Lepek,"Jí vše, zaměřuje se na ""zdravé"" potraviny"
Diet,25,Female,80,170,Very Active,"Úzkostné stavy
Nadváha","Zhubnout
Zlepšit psychický stav",Anxiolytika,Intolerance na laktózu,"Low-carb redukční dieta, nejí mléčné výrobky kvůli laktóze, hodně omezuje sůl ve stravě"
20,Male,65,175,Lightly Active,"General health, lack of sleep and vitamin D","Feel better, balanced hormones, boost testosteron lebels","Zinc, Tribulus Terestris, Ginkgo biloba & Magnesium, Vitamin D + K1&K2, Ashwaghandha ",No allergies,General diet
